{"goldenVectors":[{"expected":{"knowledgeMastery":[{"knowledgePointId":"arrays","probability":0.2689414213699951},{"knowledgePointId":"graphs","probability":0.11920292202211755}],"probability":0.18242552380635632},"id":"synthetic_contract_vector","input":{"actorFeatures":[{"featureId":"log1p_rating","value":0},{"featureId":"knowledge_value","value":0},{"featureId":"knowledge_present","value":0},{"featureId":"accuracy_value","value":0},{"featureId":"accuracy_present","value":0},{"featureId":"quality_value","value":0},{"featureId":"quality_present","value":0},{"featureId":"flexibility_value","value":0},{"featureId":"flexibility_present","value":0},{"featureId":"proficiency_value","value":0},{"featureId":"proficiency_present","value":0},{"featureId":"log1p_exam_count","value":0},{"featureId":"log1p_rating_history_count","value":0}],"featureSchemaSha256":"09c18717b8de4b3dba6c8bd9341fb237176c6d22ab7f99e2e937bf7b387a060f","knowledgeCatalogSha256":"a58370ec66def22b13a0bd64acf195e9fa28530e81481e7ade2545aaaa9bfe3c","knowledgeWeights":[{"knowledgePointId":"arrays","weight":0.5},{"knowledgePointId":"graphs","weight":0.5}],"problemFeatures":[{"featureId":"actor_acceptance_rate","value":0},{"featureId":"submission_acceptance_rate","value":0},{"featureId":"log1p_participant_count","value":0},{"featureId":"log1p_submission_count","value":0},{"featureId":"log1p_accepted_actor_count","value":0},{"featureId":"log1p_accepted_submission_count","value":0},{"featureId":"log1p_attempting_actor_count","value":0},{"featureId":"log1p_max_score_value","value":0},{"featureId":"max_score_present","value":0},{"featureId":"log1p_time_limit_ms_value","value":0},{"featureId":"time_limit_ms_present","value":0},{"featureId":"log1p_memory_limit_bytes_value","value":0},{"featureId":"memory_limit_bytes_present","value":0}]}}],"manifest":{"actorFeatureIds":["log1p_rating","knowledge_value","knowledge_present","accuracy_value","accuracy_present","quality_value","quality_present","flexibility_value","flexibility_present","proficiency_value","proficiency_present","log1p_exam_count","log1p_rating_history_count"],"algorithm":"knowledge_mirt_feature_v1","featureSchemaSha256":"09c18717b8de4b3dba6c8bd9341fb237176c6d22ab7f99e2e937bf7b387a060f","goldenVectorsSha256":"7d58b8928c63db79e9def453b900025c98d0bdf4ca9e127206a2ccf5738bb11b","inferenceContract":"ascendany.recommendation.inference.v1","knowledgeCatalogSha256":"a58370ec66def22b13a0bd64acf195e9fa28530e81481e7ade2545aaaa9bfe3c","knowledgePointIds":["arrays","graphs"],"modelId":"00000000-0000-4000-8000-000000000001","parameterSha256":"6e9ad549f447806bfcf4a5c4b8670d63ffbec8b0fbdc6bc3de5a50fe27d01210","problemFeatureIds":["actor_acceptance_rate","submission_acceptance_rate","log1p_participant_count","log1p_submission_count","log1p_accepted_actor_count","log1p_accepted_submission_count","log1p_attempting_actor_count","log1p_max_score_value","max_score_present","log1p_time_limit_ms_value","time_limit_ms_present","log1p_memory_limit_bytes_value","memory_limit_bytes_present"],"purpose":"acceptance_test","trainedAt":"2000-01-01T00:00:00.123456Z","trainingProvenanceSha256":"a2513967a725e6a8ba8dcff3fdb6188a437c4a6eec74a668e48440ea651f19f7"},"parameters":{"actorNormalization":{"means":[0,0,0,0,0,0,0,0,0,0,0,0,0],"scales":[1,1,1,1,1,1,1,1,1,1,1,1,1]},"difficultyBias":0,"discrimination":1,"knowledgeParameters":[{"actorFeatureWeights":[0,0,0,0,0,0,0,0,0,0,0,0,0],"bias":-1,"knowledgePointId":"arrays"},{"actorFeatureWeights":[0,0,0,0,0,0,0,0,0,0,0,0,0],"bias":-2,"knowledgePointId":"graphs"}],"problemFeatureWeights":[0,0,0,0,0,0,0,0,0,0,0,0,0],"problemNormalization":{"means":[0,0,0,0,0,0,0,0,0,0,0,0,0],"scales":[1,1,1,1,1,1,1,1,1,1,1,1,1]}},"schema":"ascendany.recommendation.inference-model.v1"}